web-scraper-order,restaurant_name,total_stars,number_of_reviews,cuisine_type,price_class,raw_description,opening_times,address,district,long_lat,all_amenities,lat,long,takes_reservations,delivery,outdoor_seating,good_for_kids,good_for_groups,tv
1705096921-169,STERNEN GRILL,4.3,148,BBQ & Barbecue,1.0,"Am Sternen Grill am Bellevue Zürich trifft sich die Welt. Hier geniessen Weltstars, Touristen, Pendler,
Studenten, Pensionäre, Prominente, Einheimische, Geschäftsleute und alle Wurstliebhaber ""das
Original"" und viele weitere Schweizer Klassiker bis spät in die Nacht. Heiss begehrt ist dabei die St.…",10:30 AM - 11:45 PM,,1,https://maps.googleapis.com/maps/api/staticmap?size=315x150&sensor=false&client=gme-yelp&language=en&scale=1&zoom=15&center=47.367154%2C8.545499&markers=scale%3A1%7Cicon%3Ahttps%3A%2F%2Fyelp-images.s3.amazonaws.com%2Fassets%2Fmap-markers%2Fannotation_32x43.png%7C47.367154%2C8.545499&signature=aDdih4XwGSFiHe03ZKi-Vy7E_ds=,"Bestellung zum AbholenKeine ReservierungenKein LieferserviceSitzplätze im FreienLegerModerate LautstärkeFür Gruppen geeignetFür Kinder geeignetEmpfehlenswert für: Mittagessen, AbendessenParkieren im ParkhausBedienungWLAN kostenlosAlle AlkoholikaHunde erlaubtRollstuhlgerechtTV",47.367154,8.545499,,0.0,1.0,1.0,1.0,1.0
1705096935-171,Isebähnli,4.6,37,Wirtschaft & Beiz,3.0,,"12:00 PM - 2:00 PM, 6:00 PM - 11:30 PM",Froschaugasse 26 8001 Zürich,1,https://maps.googleapis.com/maps/api/staticmap?size=315x150&sensor=false&client=gme-yelp&language=en&scale=1&zoom=15&center=47.373180%2C8.544910&markers=scale%3A1%7Cicon%3Ahttps%3A%2F%2Fyelp-images.s3.amazonaws.com%2Fassets%2Fmap-markers%2Fannotation_32x43.png%7C47.373180%2C8.544910&signature=KgViuidJzkXSPGsvKHFdXhCOniY=,"Reservationen möglichBestellung zum AbholenKein LieferserviceSitzplätze im FreienVertraut, RomantischModerate LautstärkeFür Gruppen geeignetBedienungWLAN kostenlosAlle AlkoholikaNicht für Kinder geeignetKein TV",47.37318,8.54491,1.0,0.0,1.0,0.0,1.0,1.0
1705096942-172,Restaurant Markthalle,4.1,22,Schweizer Küche,2.0,Gruppen und Bankette,9:00 AM - 12:00 AM (Folgetag),Limmatstrasse 231 8005 Zürich,5,https://maps.googleapis.com/maps/api/staticmap?size=315x150&sensor=false&client=gme-yelp&language=en&scale=1&zoom=15&center=47.387600%2C8.526130&markers=scale%3A1%7Cicon%3Ahttps%3A%2F%2Fyelp-images.s3.amazonaws.com%2Fassets%2Fmap-markers%2Fannotation_32x43.png%7C47.387600%2C8.526130&signature=TksW5982ToXwI08QWCPvq3s1-jw=,Reservationen möglichKein LieferserviceKeine MitnahmeSitzplätze im FreienEdelModerate LautstärkeFür Gruppen geeignetFür Kinder geeignetEmpfehlenswert für: BrunchParkieren an der StrasseWLAN kostenlosAlle AlkoholikaKein TV,47.3876,8.52613,1.0,0.0,1.0,1.0,1.0,1.0
1705096951-173,India Street Food,4.0,18,Indisch,1.0,,11:30 AM - 11:30 PM,Langstrasse 213 8005 Zürich,5,https://maps.googleapis.com/maps/api/staticmap?size=315x150&sensor=false&client=gme-yelp&language=en&scale=1&zoom=15&center=47.383128%2C8.530095&markers=scale%3A1%7Cicon%3Ahttps%3A%2F%2Fyelp-images.s3.amazonaws.com%2Fassets%2Fmap-markers%2Fannotation_32x43.png%7C47.383128%2C8.530095&signature=7dFrOlkbIMgFejfnSm6KQ4A_hqA=,Bestellung zum AbholenKeine ReservierungenKein LieferserviceLegerModerate LautstärkeFür Gruppen geeignetFür Kinder geeignetEmpfehlenswert für: MittagessenTVKeine Sitzplätze im FreienKein WLANKein Alkohol,47.383128,8.530095,,0.0,1.0,1.0,1.0,1.0
1705096958-174,Ristorante Italia,4.4,44,Italienisch,2.0,,"11:30 AM - 2:00 PM, 6:00 PM - 12:00 AM (Folgetag)",Zeughausstrasse 61 8004 Zürich,4,https://maps.googleapis.com/maps/api/staticmap?size=315x150&sensor=false&client=gme-yelp&language=en&scale=1&zoom=15&center=47.376360%2C8.529223&markers=scale%3A1%7Cicon%3Ahttps%3A%2F%2Fyelp-images.s3.amazonaws.com%2Fassets%2Fmap-markers%2Fannotation_32x43.png%7C47.376360%2C8.529223&signature=ZejLncff2sVQqFK5aG78dkLbJHE=,Reservationen möglichBestellung zum AbholenKein LieferserviceSitzplätze im FreienLegerModerate LautstärkeFür Gruppen geeignetFür Kinder geeignetAlle AlkoholikaTVKein WLAN,47.37636,8.529223,1.0,0.0,1.0,1.0,1.0,1.0
1705096966-175,Più,4.9,8,Italienisch,,,9:00 AM - 11:45 PM,Hardstrasse 259 8005 Zürich,5,https://maps.googleapis.com/maps/api/staticmap?size=315x150&sensor=false&client=gme-yelp&language=en&scale=1&zoom=15&center=47.388816%2C8.520099&markers=scale%3A1%7Cicon%3Ahttps%3A%2F%2Fyelp-images.s3.amazonaws.com%2Fassets%2Fmap-markers%2Fannotation_32x43.png%7C47.388816%2C8.520099&signature=IcHridndV9vNJQ31BsTHSYdsKkM=,Reservationen möglichBestellung zum AbholenKein LieferserviceSitzplätze im FreienBedienungAlle AlkoholikaHunde erlaubtRollstuhlgerechtKein TV,47.388816,8.520099,1.0,0.0,1.0,,,1.0
1705096974-176,Kang In,4.7,16,Kambodschanisch,2.0,,"11:30 AM - 2:30 PM, 5:30 PM - 10:30 PM",Zürichstrasse 27 8600 Dübendorf,,https://maps.googleapis.com/maps/api/staticmap?size=315x150&sensor=false&client=gme-yelp&language=en&scale=1&zoom=15&center=47.396598%2C8.614242&markers=scale%3A1%7Cicon%3Ahttps%3A%2F%2Fyelp-images.s3.amazonaws.com%2Fassets%2Fmap-markers%2Fannotation_32x43.png%7C47.396598%2C8.614242&signature=9K8Niv0UMVHGWWgkgZfgZCZp2yU=,Reservationen möglichBestellung zum AbholenKein LieferserviceSitzplätze im FreienLautFür Gruppen geeignetFür Kinder geeignetAlle AlkoholikaTVKein WLAN,47.396598,8.614242,1.0,0.0,1.0,1.0,1.0,1.0
1705096998-179,Chickeria,3.5,8,Fast Food,1.0,"Why is there no restaurant that offers a varied, daily fresh range of top quality food in the blink of
an eye and at the same time fulfils a local lifestyle? A world between a modern restaurant and Swiss
charm. This is the world of Chickeria - or in short: ""Schnell öpis feins"".",8:00 AM - 1:00 AM (Folgetag),Hofwiesenstrasse 370 8050 Zürich,11,https://maps.googleapis.com/maps/api/staticmap?size=315x150&sensor=false&client=gme-yelp&language=en&scale=1&zoom=15&center=47.411347%2C8.544882&markers=scale%3A1%7Cicon%3Ahttps%3A%2F%2Fyelp-images.s3.amazonaws.com%2Fassets%2Fmap-markers%2Fannotation_32x43.png%7C47.411347%2C8.544882&signature=47kNodnoTobFn8lkQmADZ5PENGw=,Bestellung zum AbholenKeine ReservierungenKein LieferserviceSitzplätze im FreienModerate LautstärkeFür Gruppen geeignetFür Kinder geeignetNur Bier & WeinKeine BedienungKein Drive-InKein TV,47.411347,8.544882,,0.0,1.0,1.0,1.0,1.0
1705097004-180,Restaurant Bi Ois,5.0,1,Schweizer Küche,2.0,,,Quellenstrasse 49 8005 Zürich,5,https://maps.googleapis.com/maps/api/staticmap?size=315x150&sensor=false&client=gme-yelp&language=en&scale=1&zoom=15&center=47.386260%2C8.528688&markers=scale%3A1%7Cicon%3Ahttps%3A%2F%2Fyelp-images.s3.amazonaws.com%2Fassets%2Fmap-markers%2Fannotation_32x43.png%7C47.386260%2C8.528688&signature=XIjLOIG3f5SV3lzNm1DchTDWT_U=,Reservationen möglichSitzplätze im FreienFür Gruppen geeignetFür Kinder geeignetBedienungNur Bier & WeinTV,47.38626,8.528688,1.0,,1.0,1.0,1.0,1.0
1705097010-181,Da Marco,4.7,3,Italienisch,2.0,,,,5,https://maps.googleapis.com/maps/api/staticmap?size=315x150&sensor=false&client=gme-yelp&language=en&scale=1&zoom=15&center=47.384436%2C8.531759&markers=scale%3A1%7Cicon%3Ahttps%3A%2F%2Fyelp-images.s3.amazonaws.com%2Fassets%2Fmap-markers%2Fannotation_32x43.png%7C47.384436%2C8.531759&signature=4iw-T-m_8m2YW7kSFgDzfGOYsPw=,Reservationen möglichBestellung zum AbholenFür Gruppen geeignetFür Kinder geeignet,47.384436,8.531759,1.0,,,1.0,1.0,
1705097017-182,Brisket,4.2,47,Bar,2.0,,"11:30 AM - 2:00 PM, 6:00 PM - 11:30 PM",Pfingstweidstrasse 6 8005 Zürich,5,https://maps.googleapis.com/maps/api/staticmap?size=315x150&sensor=false&client=gme-yelp&language=en&scale=1&zoom=15&center=47.387943%2C8.518546&markers=scale%3A1%7Cicon%3Ahttps%3A%2F%2Fyelp-images.s3.amazonaws.com%2Fassets%2Fmap-markers%2Fannotation_32x43.png%7C47.387943%2C8.518546&signature=TtUkLvT2HShzeaFb5QhT2eKJyd4=,"Reservationen möglichBestellung zum AbholenKein LieferserviceSitzplätze im FreienLeger, TrendyLautFür Gruppen geeignetFür Kinder geeignetEmpfehlenswert für: Mittagessen, AbendessenBedienungBeste Nächte: Freitag, Samstag, SonntagAlle AlkoholikaRauchen nur im Freien erlaubtHunde erlaubtNicht zum Tanzen geeignetKein BilliardtischKein WLANKein TV",47.387943,8.518546,1.0,0.0,1.0,1.0,1.0,1.0
1705097024-183,Moudi's lecker Garten,4.3,8,Libanesisch,2.0,"Lecker. Frisch. Authentisch. Gesund. Wir interpretieren die libanesische Küche neu. Anders. Wie wir
es mögen. Unsere 47 Mezzesorten sind ausnahmslos selbst zubereitet. Ebenso ist jede Schale, jeder
Löffel und natürlich unsere Zutaten persönlich ausgesucht und zusammengestellt. Der lecker Gart…",11:30 AM - 11:00 PM,Winterthurerstrasse 86 8006 Zürich,6,https://maps.googleapis.com/maps/api/staticmap?size=315x150&sensor=false&client=gme-yelp&language=en&scale=1&zoom=15&center=47.390924%2C8.545685&markers=scale%3A1%7Cicon%3Ahttps%3A%2F%2Fyelp-images.s3.amazonaws.com%2Fassets%2Fmap-markers%2Fannotation_32x43.png%7C47.390924%2C8.545685&signature=3HE6ZHn0Q2SCRmcH34Ks-e36o1o=,Reservationen möglichKein LieferserviceKeine MitnahmeFür Gruppen geeignetFür Kinder geeignetBedienungAlle AlkoholikaTV,47.390924,8.545685,1.0,0.0,,1.0,1.0,1.0
1705097031-184,Chuchi am Wasser,3.4,9,Café,2.0,,10:30 AM - 11:00 PM,Wasserwerkstrasse 21 8006 Zürich,6,https://maps.googleapis.com/maps/api/staticmap?size=315x150&sensor=false&client=gme-yelp&language=en&scale=1&zoom=15&center=47.383032%2C8.539669&markers=scale%3A1%7Cicon%3Ahttps%3A%2F%2Fyelp-images.s3.amazonaws.com%2Fassets%2Fmap-markers%2Fannotation_32x43.png%7C47.383032%2C8.539669&signature=6yyNDQDh3QT0EkfQTeKu6JxZYUQ=,Reservationen möglichBestellung zum AbholenKein LieferserviceSitzplätze im FreienModerate LautstärkeFür Gruppen geeignetFür Kinder geeignetGeeignet zum ArbeitenWLAN kostenlosAlle AlkoholikaTV,47.383032,8.539669,1.0,0.0,1.0,1.0,1.0,1.0
1705097046-186,Maki Haus,4.5,6,Japanisch,,,,Stampfenbachstrasse 12 8001 Zürich,1,https://maps.googleapis.com/maps/api/staticmap?size=315x150&sensor=false&client=gme-yelp&language=en&scale=1&zoom=15&center=47.378156%2C8.543775&markers=scale%3A1%7Cicon%3Ahttps%3A%2F%2Fyelp-images.s3.amazonaws.com%2Fassets%2Fmap-markers%2Fannotation_32x43.png%7C47.378156%2C8.543775&signature=xWjo2tDGEocGrcoo5t6rX0_INUQ=,Edel,47.378156,8.543775,,,,,,
1705097053-187,Texas,4.1,15,Amerikanisch,3.0,,"11:30 AM - 2:00 PM, 5:00 PM - 11:00 PM",Usterstrasse 68 8600 Dübendorf,,https://maps.googleapis.com/maps/api/staticmap?size=315x150&sensor=false&client=gme-yelp&language=en&scale=1&zoom=15&center=47.396377%2C8.626134&markers=scale%3A1%7Cicon%3Ahttps%3A%2F%2Fyelp-images.s3.amazonaws.com%2Fassets%2Fmap-markers%2Fannotation_32x43.png%7C47.396377%2C8.626134&signature=jCI1zLqLxw1EcdNz8hRe5W2NSss=,Reservationen möglichBestellung zum AbholenKein LieferserviceSitzplätze im FreienLegerModerate LautstärkeFür Gruppen geeignetFür Kinder geeignetEmpfehlenswert für: DessertAlle AlkoholikaTVKein WLAN,47.396377,8.626134,1.0,0.0,1.0,1.0,1.0,1.0
1705097061-188,Fujiya,4.5,13,Japanisch,3.0,"Japanische Küche eindrücklich zelebriert  Im Restaurant Fujiya of Japan, dem ersten
Teppanyaki-Restaurant der Schweiz, bereiten japanische Spitzenköche vor Ihren Augen
Tischgrill-Spezialitäten mit eindrücklicher Fingerfertigkeit zu.  Hier finden Sie Genuss für Augen un…","11:45 AM - 2:00 PM, 6:00 PM - 11:30 PM",Oberhauserstrasse 30 8152 Glattbrugg,,https://maps.googleapis.com/maps/api/staticmap?size=315x150&sensor=false&client=gme-yelp&language=en&scale=1&zoom=15&center=47.431459%2C8.566852&markers=scale%3A1%7Cicon%3Ahttps%3A%2F%2Fyelp-images.s3.amazonaws.com%2Fassets%2Fmap-markers%2Fannotation_32x43.png%7C47.431459%2C8.566852&signature=GTYNsQy-f5gTn4yQKZ7H8rgHxKs=,Reservationen möglichBestellung zum AbholenKein LieferserviceSitzplätze im FreienModerate LautstärkeFür Gruppen geeignetParkieren auf KundenparkplatzWLAN kostenlosAlle AlkoholikaNicht für Kinder geeignetKein TV,47.431459,8.566852,1.0,0.0,1.0,0.0,1.0,1.0
1705097069-189,Rosita's Food & Drinks,4.6,5,Salat,1.0,,,Lagerstrasse 95 8004 Zürich,4,https://maps.googleapis.com/maps/api/staticmap?size=315x150&sensor=false&client=gme-yelp&language=en&scale=1&zoom=15&center=47.379314%2C8.529784&markers=scale%3A1%7Cicon%3Ahttps%3A%2F%2Fyelp-images.s3.amazonaws.com%2Fassets%2Fmap-markers%2Fannotation_32x43.png%7C47.379314%2C8.529784&signature=G6BCDuELX54OuR9bq4oK5qML8d4=,Bestellung zum AbholenKeine ReservierungenKeine Sitzplätze im FreienNicht für Gruppen geeignetKein WLAN,47.379314,8.529784,,,1.0,,0.0,
1705097076-190,LaSalle,4.2,40,Modern-Europäisch,3.0,"Das LaSalle ist ein klassisch-modernes Restaurant ohne Effekthascherei - weder in der Küche noch
in der Architektur.Die meisten Gerichte haben ihre Wurzeln in der französischen oder italienischen
Küche. Dabei bilden Fisch und Meeresfrüchte den Schwerpunkt, ergänzt durch Fleisch und Geflüg…",11:00 AM - 2:00 AM (Folgetag),Schiffbau Schiffbaustrasse 4 8005 Zürich,5,https://maps.googleapis.com/maps/api/staticmap?size=315x150&sensor=false&client=gme-yelp&language=en&scale=1&zoom=15&center=47.388700%2C8.519130&markers=scale%3A1%7Cicon%3Ahttps%3A%2F%2Fyelp-images.s3.amazonaws.com%2Fassets%2Fmap-markers%2Fannotation_32x43.png%7C47.388700%2C8.519130&signature=5QspzU5AYN3djDnqW_Ts66xJWjI=,"Reservationen möglichKein LieferserviceKeine MitnahmeSitzplätze im FreienEdel, TrendyModerate LautstärkeSchickFür Gruppen geeignetParkieren im ParkhausWLAN kostenlosAlle AlkoholikaRauchen nur im Freien erlaubtTVNicht für Kinder geeignetNicht zum Tanzen geeignet",47.3887,8.51913,1.0,0.0,1.0,0.0,1.0,1.0
1705097083-191,Piccolo Giardino,4.3,22,Bar,1.0,,11:00 AM - 2:30 AM (Folgetag),Schöneggplatz 9 8004 Zürich,4,https://maps.googleapis.com/maps/api/staticmap?size=315x150&sensor=false&client=gme-yelp&language=en&scale=1&zoom=15&center=47.380837%2C8.525748&markers=scale%3A1%7Cicon%3Ahttps%3A%2F%2Fyelp-images.s3.amazonaws.com%2Fassets%2Fmap-markers%2Fannotation_32x43.png%7C47.380837%2C8.525748&signature=APrelCfZLNb8BkQ_l4XSqWxS23w=,Reservationen möglichKein LieferserviceKeine MitnahmeSitzplätze im FreienLegerModerate LautstärkeFür Gruppen geeignetFür Kinder geeignetNur Bier & WeinTVKein Billiardtisch,47.380837,8.525748,1.0,0.0,1.0,1.0,1.0,1.0
1705097090-192,Wesley's Kitchen,3.5,23,Chinesisch,2.0,,"11:30 AM - 2:30 PM, 5:00 PM - 10:00 PM",Josefstrasse 48 8005 Zürich,5,https://maps.googleapis.com/maps/api/staticmap?size=315x150&sensor=false&client=gme-yelp&language=en&scale=1&zoom=15&center=47.381855%2C8.532708&markers=scale%3A1%7Cicon%3Ahttps%3A%2F%2Fyelp-images.s3.amazonaws.com%2Fassets%2Fmap-markers%2Fannotation_32x43.png%7C47.381855%2C8.532708&signature=bs-OXDpD1vi6TX_9jlpK1iQnJ0E=,"Reservationen möglichBestellung zum AbholenKein LieferserviceSitzplätze im FreienEdel, LegerLautEmpfehlenswert für: Mittagessen, AbendessenWLAN kostenlosNur Bier & WeinTVNicht für Gruppen geeignetNicht für Kinder geeignetKeine Bedienung",47.381855,8.532708,1.0,0.0,1.0,0.0,0.0,1.0
1705097095-193,Restaurant Thach,4.5,2,Vietnamesisch,,,"11:00 AM - 2:00 PM, 5:00 PM - 10:00 PM",Militärstrasse 84 8004 Zürich,4,https://maps.googleapis.com/maps/api/staticmap?size=315x150&sensor=false&client=gme-yelp&language=en&scale=1&zoom=15&center=47.378804%2C8.529779&markers=scale%3A1%7Cicon%3Ahttps%3A%2F%2Fyelp-images.s3.amazonaws.com%2Fassets%2Fmap-markers%2Fannotation_32x43.png%7C47.378804%2C8.529779&signature=g8g4iIQIk-DonWyC79d5ymUdYr8=,Reservationen möglich,47.378804,8.529779,1.0,,,,,
1705097103-194,Ristorante La Pasta,4.3,75,Italienisch,2.0,,"11:30 AM - 2:30 PM, 5:30 PM - 11:00 PM",Niederdorfstrasse 80 8001 Zürich,1,https://maps.googleapis.com/maps/api/staticmap?size=315x150&sensor=false&client=gme-yelp&language=en&scale=1&zoom=15&center=47.376028%2C8.544166&markers=scale%3A1%7Cicon%3Ahttps%3A%2F%2Fyelp-images.s3.amazonaws.com%2Fassets%2Fmap-markers%2Fannotation_32x43.png%7C47.376028%2C8.544166&signature=k7jt61kwlZL_8NSYh57UA-ue7Eg=,Reservationen möglichBestellung zum AbholenKein LieferserviceSitzplätze im FreienLegerModerate LautstärkeFür Gruppen geeignetFür Kinder geeignetBedienungWLAN kostenlosAlle AlkoholikaTV,47.376028,8.544166,1.0,0.0,1.0,1.0,1.0,1.0
1705097119-196,Le Muh,3.8,26,Schweizer Küche,2.0,,6:30 AM - 12:00 AM (Folgetag),Schulstrasse 44 8050 Zürich,11,https://maps.googleapis.com/maps/api/staticmap?size=315x150&sensor=false&client=gme-yelp&language=en&scale=1&zoom=15&center=47.410764%2C8.543725&markers=scale%3A1%7Cicon%3Ahttps%3A%2F%2Fyelp-images.s3.amazonaws.com%2Fassets%2Fmap-markers%2Fannotation_32x43.png%7C47.410764%2C8.543725&signature=N9VE1vmPtLKZIE2JF0fjgzbEAIw=,"Reservationen möglichKein LieferserviceKeine MitnahmeSitzplätze im FreienEdel, LegerModerate LautstärkeFür Gruppen geeignetFür Kinder geeignetParkieren im ParkhausWLAN kostenlosAlle AlkoholikaTV",47.410764,8.543725,1.0,0.0,1.0,1.0,1.0,1.0
1705097127-197,Tantpis,4.1,11,Mediterran,2.0,"Das Tantpis ist ein aufgeschlossenes, liebevoll eingerichtetes mediterranes Café/Restaurant. Die
freundliche und familiäre Atmosphäre sowie ein reiches Angebot an Speisen und Getränken laden
zum einkehren ein.  Tagsüber servieren wir Speisen aus verschiedenen Küchen der Welt und am A…","10:00 AM - 2:30 PM, 5:30 PM - 11:30 PM",Konradstrasse 73 8005 Zürich,5,https://maps.googleapis.com/maps/api/staticmap?size=315x150&sensor=false&client=gme-yelp&language=en&scale=1&zoom=15&center=47.382063%2C8.533306&markers=scale%3A1%7Cicon%3Ahttps%3A%2F%2Fyelp-images.s3.amazonaws.com%2Fassets%2Fmap-markers%2Fannotation_32x43.png%7C47.382063%2C8.533306&signature=GjW0dJRsg-KvDZ3-p1QzcQh0t1w=,Reservationen möglichBestellung zum AbholenKein LieferserviceVegane AngeboteSitzplätze im FreienModerate LautstärkeFür Gruppen geeignetFür Kinder geeignetParkieren an der StrasseBedienungWLAN kostenlosAlle AlkoholikaRollstuhlgerechtKein TV,47.382063,8.533306,1.0,0.0,1.0,1.0,1.0,1.0
1705097135-198,La Rotisserie,4.6,8,Schweizer Küche,3.0,,11:30 AM - 12:00 AM (Folgetag),Weinplatz  2 8001 Zürich,1,https://maps.googleapis.com/maps/api/staticmap?size=315x150&sensor=false&client=gme-yelp&language=en&scale=1&zoom=15&center=47.370886%2C8.541641&markers=scale%3A1%7Cicon%3Ahttps%3A%2F%2Fyelp-images.s3.amazonaws.com%2Fassets%2Fmap-markers%2Fannotation_32x43.png%7C47.370886%2C8.541641&signature=d38-rUqsV18wOWTQQOAm3EvINHs=,Reservationen möglichKein LieferserviceSitzplätze im FreienEdelLeiseBedienungWLAN kostenlosAlle AlkoholikaRollstuhlgerechtNicht für Gruppen geeignetHunde nicht erlaubtKein TV,47.370886,8.541641,1.0,0.0,1.0,,0.0,1.0
1705097142-199,Il Pentagramma,4.8,16,Italienisch,1.0,,9:00 AM - 4:00 PM,Josefstrasse 28 8005 Zürich,5,https://maps.googleapis.com/maps/api/staticmap?size=315x150&sensor=false&client=gme-yelp&language=en&scale=1&zoom=15&center=47.381144%2C8.533726&markers=scale%3A1%7Cicon%3Ahttps%3A%2F%2Fyelp-images.s3.amazonaws.com%2Fassets%2Fmap-markers%2Fannotation_32x43.png%7C47.381144%2C8.533726&signature=c5jcgzVmnlQ9AA0RYURt-kgfpxc=,Bestellung zum AbholenKeine ReservierungenKein LieferserviceFür Gruppen geeignetFür Kinder geeignetTVKeine Sitzplätze im FreienKein WLANKein Alkohol,47.381144,8.533726,,0.0,1.0,1.0,1.0,1.0
1705097149-200,Fleisch am Chnoche,5.0,2,BBQ & Barbecue,,"Treffpunkt für einzigartige Gastroerlebnisse in unmittelbarer Stadtnähe, quer durch die
Jahreszeiten: Im Sommer im lauschigen, waldnahen Garten, in freier Natur, am rauschenden
Werenbach. Bei kühler Witterung, in entspannendem Ambiente in unserer gemütlichen weissgede…","11:00 AM - 2:00 PM, 6:00 PM - 12:00 AM (Folgetag)",Trichtenhausenstrasse 235 8053 Zürich,,https://maps.googleapis.com/maps/api/staticmap?size=315x150&sensor=false&client=gme-yelp&language=en&scale=1&zoom=15&center=47.350808%2C8.602018&markers=scale%3A1%7Cicon%3Ahttps%3A%2F%2Fyelp-images.s3.amazonaws.com%2Fassets%2Fmap-markers%2Fannotation_32x43.png%7C47.350808%2C8.602018&signature=EgazP3ZseSnIXDOVl3pNspoLu8g=,Reservationen möglichKein LieferserviceKeine MitnahmeSitzplätze im FreienFür Gruppen geeignetFür Kinder geeignetParkieren auf KundenparkplatzBedienungWLAN kostenlosAlle AlkoholikaHunde erlaubtRollstuhlgerechtKein TV,47.350808,8.602018,1.0,0.0,1.0,1.0,1.0,1.0
1705097155-201,Spiga,4.3,13,Italienisch,2.0,,7:00 AM - 11:00 PM,Löwenstrasse 61 8001 Zürich,1,https://maps.googleapis.com/maps/api/staticmap?size=315x150&sensor=false&client=gme-yelp&language=en&scale=1&zoom=15&center=47.376969%2C8.538036&markers=scale%3A1%7Cicon%3Ahttps%3A%2F%2Fyelp-images.s3.amazonaws.com%2Fassets%2Fmap-markers%2Fannotation_32x43.png%7C47.376969%2C8.538036&signature=I1dLzUYBOg8p0BDdvGKLnouCkaI=,Reservationen möglichLieferung möglichBestellung zum AbholenLautFür Gruppen geeignetFür Kinder geeignetWLAN kostenlosNur Bier & WeinTVKeine Sitzplätze im Freien,47.376969,8.538036,1.0,1.0,1.0,1.0,1.0,1.0
1705097167-203,4Leoni,4.7,3,Italienisch,3.0,,"11:30 AM - 2:30 PM, 6:00 PM - 11:30 PM",Luisenstrasse 43 8005 Zürich,5,https://maps.googleapis.com/maps/api/staticmap?size=315x150&sensor=false&client=gme-yelp&language=en&scale=1&zoom=15&center=47.384275%2C8.530161&markers=scale%3A1%7Cicon%3Ahttps%3A%2F%2Fyelp-images.s3.amazonaws.com%2Fassets%2Fmap-markers%2Fannotation_32x43.png%7C47.384275%2C8.530161&signature=Mmf4neUYfqriqgl0H62VJJ1KJ54=,Reservationen möglichModerate LautstärkeFür Gruppen geeignetFür Kinder geeignetBedienungAlle AlkoholikaTV,47.384275,8.530161,1.0,,,1.0,1.0,1.0
1705097174-204,Schipfe 16,4.0,13,Schweizer Küche,2.0,,10:00 AM - 10:00 PM,Schipfe 16 8001 Zürich,1,https://maps.googleapis.com/maps/api/staticmap?size=315x150&sensor=false&client=gme-yelp&language=en&scale=1&zoom=15&center=47.373123%2C8.541737&markers=scale%3A1%7Cicon%3Ahttps%3A%2F%2Fyelp-images.s3.amazonaws.com%2Fassets%2Fmap-markers%2Fannotation_32x43.png%7C47.373123%2C8.541737&signature=QiInVVzOIpMO5UDbsEByj-LDl2s=,Reservationen möglichKein LieferserviceKeine MitnahmeSitzplätze im FreienFür Kinder geeignetAlle AlkoholikaTVNicht für Gruppen geeignet,47.373123,8.541737,1.0,0.0,1.0,1.0,0.0,1.0
1705097181-205,b.good,3.9,14,Burger,1.0,,11:30 AM - 10:30 PM,Langstrasse 211 8005 Zürich,5,https://maps.googleapis.com/maps/api/staticmap?size=315x150&sensor=false&client=gme-yelp&language=en&scale=1&zoom=15&center=47.383060%2C8.529982&markers=scale%3A1%7Cicon%3Ahttps%3A%2F%2Fyelp-images.s3.amazonaws.com%2Fassets%2Fmap-markers%2Fannotation_32x43.png%7C47.383060%2C8.529982&signature=3G7dA7SMET100FXCbe_Tb7whZkU=,Bestellung zum AbholenKeine ReservierungenKein LieferserviceFür Gruppen geeignetFür Kinder geeignetWLAN kostenlosNur Bier & WeinTVKeine Sitzplätze im FreienKeine BedienungKein Drive-In,47.38306,8.529982,,0.0,1.0,1.0,1.0,1.0
1705097192-206,Yamas,4.5,6,Weinbar,2.0,,9:00 AM - 12:00 AM (Folgetag),Lagerstrasse 48 8004 Zürich,4,https://maps.googleapis.com/maps/api/staticmap?size=315x150&sensor=false&client=gme-yelp&language=en&scale=1&zoom=15&center=47.378700%2C8.531747&markers=scale%3A1%7Cicon%3Ahttps%3A%2F%2Fyelp-images.s3.amazonaws.com%2Fassets%2Fmap-markers%2Fannotation_32x43.png%7C47.378700%2C8.531747&signature=XcEBqsfKv_r1sFDE8FvFzb10NbY=,Reservationen möglichKein LieferserviceSitzplätze im FreienFür Gruppen geeignetFür Kinder geeignet,47.3787,8.531747,1.0,0.0,1.0,1.0,1.0,
1705097200-207,Damas,4.7,7,Persisch,2.0,,10:00 AM - 12:00 AM (Folgetag),Josefstrasse 151 8005 Zürich,5,https://maps.googleapis.com/maps/api/staticmap?size=315x150&sensor=false&client=gme-yelp&language=en&scale=1&zoom=15&center=47.384635%2C8.527504&markers=scale%3A1%7Cicon%3Ahttps%3A%2F%2Fyelp-images.s3.amazonaws.com%2Fassets%2Fmap-markers%2Fannotation_32x43.png%7C47.384635%2C8.527504&signature=gu-_Jq0Me969S3GZtWE0i7Z2gC0=,Reservationen möglichLieferung möglichBestellung zum AbholenSitzplätze im FreienFür Gruppen geeignetFür Kinder geeignetBedienung,47.384635,8.527504,1.0,1.0,1.0,1.0,1.0,
1705097206-208,Yalla Habibi,4.5,20,Libanesisch,1.0,Libinische Spezialität halal Fleisch Vigi& Vigan Take AwaY & catering,"11:00 AM - 2:30 PM, 5:00 PM - 11:00 PM",Meinrad Lienerstrasse 27 8003 Zürich,3,https://maps.googleapis.com/maps/api/staticmap?size=315x150&sensor=false&client=gme-yelp&language=en&scale=1&zoom=15&center=47.375148%2C8.517338&markers=scale%3A1%7Cicon%3Ahttps%3A%2F%2Fyelp-images.s3.amazonaws.com%2Fassets%2Fmap-markers%2Fannotation_32x43.png%7C47.375148%2C8.517338&signature=zYg8cvOCdp0NmG6_hW_m8fk7Loc=,Reservationen möglichLieferung möglichBestellung zum AbholenSitzplätze im FreienLegerModerate LautstärkeFür Gruppen geeignetFür Kinder geeignetEmpfehlenswert für: MittagessenParkieren an der StrasseWLAN kostenlosAlle AlkoholikaTV,47.375148,8.517338,1.0,1.0,1.0,1.0,1.0,1.0
1705097215-209,La Taqueria,4.4,74,Mexikanisch,2.0,"La Taqueria ist ein authentisches, legeres, mexikanisches Esslokal im Zentrum von Zürich-Altstetten.
 Es verbindet schnellen und freundlichen Service mit unglaublichem mexikanischen Essen (Tacos!) 
und ein einladender Ort, um ein gutes Essen, ein kaltes mexikanisches Bier oder eine authentisch…",11:30 AM - 10:00 PM,Altstetterstrasse 140 a 8048 Zürich,9,https://maps.googleapis.com/maps/api/staticmap?size=315x150&sensor=false&client=gme-yelp&language=en&scale=1&zoom=15&center=47.387881%2C8.487561&markers=scale%3A1%7Cicon%3Ahttps%3A%2F%2Fyelp-images.s3.amazonaws.com%2Fassets%2Fmap-markers%2Fannotation_32x43.png%7C47.387881%2C8.487561&signature=vFImd0ZThIq_c4XddbsF96ZA8yc=,"Reservationen möglichLieferung möglichBestellung zum AbholenSitzplätze im FreienLegerModerate LautstärkeFür Gruppen geeignetFür Kinder geeignetEmpfehlenswert für: Mittagessen, AbendessenParkieren an der Strasse, Parkieren auf KundenparkplatzWLAN kostenlosAlle AlkoholikaHunde erlaubtRollstuhlgerechtKein TV",47.387881,8.487561,1.0,1.0,1.0,1.0,1.0,1.0
